{
  "proposal_id": "P-TEST-004",
  "status": "DRAFT",
  "author_agent": "AXIOM-POLICY",
  "created_at": "2026-10-21T15:57:52.431Z",
  "source": {
    "document": "corpus/SOP_CDD_v4.2_excerpt.md",
    "clauses_parsed": 15,
    "clauses_without_implementing_rule": [
      {
        "clause_id": "4.2",
        "kind": "MANDATORY_STEP",
        "quote": "A passport, national identity card or equivalent official photographic document shall be obtained and its validity recorded at the time of onboarding."
      },
      {
        "clause_id": "7.3",
        "kind": "DEADLINE",
        "quote": "Enhanced due diligence must be completed within 30 days of the relationship being established where the customer presents a high risk. Section 8 \u2014 Documentation"
      }
    ],
    "coverage": 86.7
  },
  "change": {
    "kind": "data_patch",
    "pointer": "/config/thresholds/ubo_pct",
    "old": 99,
    "new": 20
  },
  "candidate": {
    "file": "policy/data.json",
    "pointer": "/config/thresholds/ubo_pct",
    "old": 99,
    "new": 20
  },
  "validation": {
    "check_ok": false,
    "tests_ok": false,
    "fmt_ok": false,
    "restricted_capabilities": true,
    "error": "precondition failed: expected 99 at /config/thresholds/ubo_pct, found 25"
  },
  "impact": {
    "skipped": "candidate did not compile or failed tests",
    "cases_evaluated": 0,
    "changes": []
  },
  "required_approvals": [
    "FINANCIAL_CRIME",
    "MODEL_RISK",
    "PLATFORM_SECURITY",
    "POLICY_OWNER"
  ],
  "activation": {
    "permitted_by_agent": false,
    "reason": "policy.activate is a prohibited action for every agent"
  }
}
